"No.","Time","Source","Destination","Protocol","Length","Info"
"1","0.000000","SamsungE_a3:ec:d0","Broadcast","ARP","60","Who has 192.168.1.1? Tell 192.168.1.21"
"2","0.496407","192.168.1.3","54.149.94.178","TLSv1.2","122","Application Data"
"3","0.497430","192.168.1.3","172.217.3.174","UDP","1392","61463  >  443 Len=1350"
"4","0.527301","54.149.94.178","192.168.1.3","TLSv1.2","122","Application Data"
"5","0.527389","192.168.1.3","54.149.94.178","TCP","66","50908  >  443 [ACK] Seq=57 Ack=57 Win=2047 Len=0 TSval=1877935662 TSecr=1314674307"
"6","0.535290","172.217.3.174","192.168.1.3","UDP","1392","443  >  61463 Len=1350"
"7","0.535735","192.168.1.3","172.217.3.174","UDP","70","61463  >  443 Len=28"
"8","0.535929","192.168.1.3","172.217.3.174","UDP","989","61463  >  443 Len=947"
"9","0.536055","192.168.1.3","172.217.3.174","UDP","778","61463  >  443 Len=736"
"10","0.560264","172.217.3.174","192.168.1.3","UDP","62","443  >  61463 Len=20"
"11","0.569169","172.217.3.174","192.168.1.3","UDP","872","443  >  61463 Len=830"
"12","0.569174","172.217.3.174","192.168.1.3","UDP","108","443  >  61463 Len=66"
"13","0.569176","172.217.3.174","192.168.1.3","UDP","454","443  >  61463 Len=412"
"14","0.569186","172.217.3.174","192.168.1.3","UDP","269","443  >  61463 Len=227"
"15","0.569694","192.168.1.3","172.217.3.174","UDP","70","61463  >  443 Len=28"
"16","0.569843","192.168.1.3","172.217.3.174","UDP","70","61463  >  443 Len=28"
"17","2.309127","192.168.1.3","74.125.195.189","UDP","75","51561  >  443 Len=33"
"18","2.354781","74.125.195.189","192.168.1.3","UDP","68","443  >  51561 Len=26"
"19","2.386191","192.168.1.3","74.125.142.189","UDP","65","61825  >  443 Len=23"
"20","2.411340","74.125.142.189","192.168.1.3","UDP","64","443  >  61825 Len=22"
"21","2.924823","192.168.1.3","74.125.142.189","UDP","75","60610  >  443 Len=33"
"22","2.959371","74.125.142.189","192.168.1.3","UDP","68","443  >  60610 Len=26"
"23","2.962131","192.168.1.3","192.168.1.11","TCP","176","53628  >  8009 [PSH, ACK] Seq=1 Ack=1 Win=2048 Len=110 TSval=1877938090 TSecr=5243226 [TCP segment of a reassembled PDU]"
"24","2.967966","192.168.1.11","192.168.1.3","TCP","176","8009  >  53628 [PSH, ACK] Seq=1 Ack=111 Win=660 Len=110 TSval=5243727 TSecr=1877938090 [TCP segment of a reassembled PDU]"
"25","2.968045","192.168.1.3","192.168.1.11","TCP","66","53628  >  8009 [ACK] Seq=111 Ack=111 Win=2046 Len=0 TSval=1877938095 TSecr=5243727"
"26","3.035204","192.168.1.3","172.217.14.197","TLSv1.2","90","Application Data"
"27","3.035355","192.168.1.3","172.217.14.197","TCP","66","55666  >  443 [FIN, ACK] Seq=25 Ack=1 Win=2048 Len=0 TSval=1877938161 TSecr=3843875851"
"28","3.053112","172.217.14.197","192.168.1.3","TCP","66","443  >  55666 [ACK] Seq=1 Ack=25 Win=315 Len=0 TSval=3843995946 TSecr=1877938161"
"29","3.053119","172.217.14.197","192.168.1.3","TCP","66","443  >  55666 [FIN, ACK] Seq=1 Ack=26 Win=315 Len=0 TSval=3843995946 TSecr=1877938161"
"30","3.053249","192.168.1.3","172.217.14.197","TCP","66","55666  >  443 [ACK] Seq=26 Ack=2 Win=2048 Len=0 TSval=1877938178 TSecr=3843995946"
"31","3.282564","SamsungE_a3:ec:d0","Broadcast","ARP","60","Who has 192.168.1.1? Tell 192.168.1.21"
"32","3.485979","74.125.142.189","192.168.1.3","UDP","85","443  >  61825 Len=43"
"33","3.492109","192.168.1.3","74.125.142.189","UDP","71","61825  >  443 Len=29"
"34","3.685945","192.168.1.12","224.0.0.251","MDNS","136","Standard query 0x00c3 PTR _%9E5E7C8F47989526C9BCD95D24084F6F0B27C5ED._sub._googlecast._tcp.local, ""QM"" question PTR _googlecast._tcp.local, ""QM"" question"
"35","3.686948","192.168.1.11","224.0.0.251","MDNS","421","Standard query response 0x0000 PTR Google-Home-Mini-d32bc91b75e125ead80a59ba121b2e34._googlecast._tcp.local TXT, cache flush SRV, cache flush 0 0 8009 d32bc91b-75e1-25ea-d80a-59ba121b2e34.local A, cache flush 192.168.1.11"
"36","5.493293","192.168.1.3","44.242.82.234","TLSv1.2","108","Application Data"
"37","5.525467","44.242.82.234","192.168.1.3","TLSv1.2","104","Application Data"
"38","5.525519","192.168.1.3","44.242.82.234","TCP","66","50919  >  443 [ACK] Seq=43 Ack=39 Win=2047 Len=0 TSval=1877940643 TSecr=258462742"
"39","6.143864","SamsungE_a3:ec:d0","Broadcast","ARP","60","Who has 192.168.1.1? Tell 192.168.1.21"
"40","6.761769","74.125.28.189","192.168.1.3","UDP","85","443  >  53320 Len=43"
"41","6.766212","74.125.28.189","192.168.1.3","UDP","85","443  >  53320 Len=43"
"42","6.767864","192.168.1.3","74.125.28.189","UDP","71","53320  >  443 Len=29"
"43","6.919832","192.168.1.3","216.58.217.35","UDP","75","62548  >  443 Len=33"
"44","6.982513","216.58.217.35","192.168.1.3","UDP","67","443  >  62548 Len=25"
"45","7.968519","192.168.1.3","192.168.1.11","TCP","176","53628  >  8009 [PSH, ACK] Seq=111 Ack=111 Win=2048 Len=110 TSval=1877943077 TSecr=5243727 [TCP segment of a reassembled PDU]"
"46","7.979701","192.168.1.11","192.168.1.3","TCP","176","8009  >  53628 [PSH, ACK] Seq=111 Ack=221 Win=660 Len=110 TSval=5244228 TSecr=1877943077 [TCP segment of a reassembled PDU]"
"47","7.979756","192.168.1.3","192.168.1.11","TCP","66","53628  >  8009 [ACK] Seq=221 Ack=221 Win=2046 Len=0 TSval=1877943088 TSecr=5244228"
"48","9.012050","SamsungE_a3:ec:d0","Broadcast","ARP","60","Who has 192.168.1.1? Tell 192.168.1.21"
"49","9.676782","192.168.1.3","192.168.1.1","DNS","84","Standard query 0x1272 PTR 3.1.168.192.in-addr.arpa"
"50","9.686617","192.168.1.3","192.168.1.1","DNS","84","Standard query 0x7737 PTR 3.1.168.192.in-addr.arpa"
"51","9.687786","192.168.1.3","192.168.1.1","DNS","84","Standard query 0x50d0 PTR 3.1.168.192.in-addr.arpa"
"52","9.701223","192.168.1.1","192.168.1.3","DNS","84","Standard query response 0x1272 No such name PTR 3.1.168.192.in-addr.arpa"
"53","9.701270","192.168.1.3","192.168.1.1","ICMP","70","Destination unreachable (Port unreachable)"
"54","9.706199","192.168.1.3","224.0.0.251","MDNS","616","Standard query 0x0000 PTR _airport._tcp.local, ""QU"" question PTR _rdlink._tcp.local, ""QU"" question PTR _uscan._tcp.local, ""QU"" question PTR _ippusb._tcp.local, ""QU"" question PTR _uscans._tcp.local, ""QU"" question PTR _ipp._tcp.local, ""QU"" question PTR _ipps._tcp.local, ""QU"" question PTR _scanner._tcp.local, ""QU"" question PTR _printer._tcp.local, ""QU"" question PTR _pdl-datastream._tcp.local, ""QU"" question PTR _ptp._tcp.local, ""QU"" question PTR _googlecast._tcp.local, ""QU"" question PTR _homekit._tcp.local, ""QU"" question PTR _companion-link._tcp.local, ""QU"" question TXT Google-Home-Mini-d32bc91b75e125ead80a59ba121b2e34._googlecast._tcp.local, ""QU"" question PTR _apple-mobdev._tcp.local, ""QU"" question PTR 94dc0821._sub._apple-mobdev2._tcp.local, ""QU"" question PTR _apple-pairable._tcp.local, ""QU"" question PTR _afpovertcp._tcp.local, ""QU"" question PTR _smb._tcp.local, ""QU"" question PTR _rfb._tcp.local, ""QU"" question PTR _adisk._tcp.local, ""QU"" question ANY Hans Gruber._companion-link._tcp.local, ""QU"" question PTR Google-Home-Mini-d32bc91b75e125ead80a59ba121b2e34._googlecast._tcp.local PTR Hans Gruber._companion-link._tcp.local PTR Massage Chair._companion-link._tcp.local PTR BRoom._companion-link._tcp.local SRV 0 0 53591 Hans-Gruber.local OPT"
"55","9.706277","192.168.1.3","224.0.0.251","MDNS","234","Standard query response 0x0000 PTR _companion-link._tcp.local TXT OPT"
"56","9.715574","192.168.1.1","192.168.1.3","DNS","84","Standard query response 0x7737 No such name PTR 3.1.168.192.in-addr.arpa"
"57","9.715577","192.168.1.1","192.168.1.3","DNS","84","Standard query response 0x50d0 No such name PTR 3.1.168.192.in-addr.arpa"
"58","9.715690","192.168.1.3","192.168.1.1","ICMP","70","Destination unreachable (Port unreachable)"
"59","9.790155","192.168.1.11","192.168.1.3","MDNS","183","Standard query response 0x0000 SRV, cache flush 0 0 8009 d32bc91b-75e1-25ea-d80a-59ba121b2e34.local"
"60","9.960515","192.168.1.3","224.0.0.251","MDNS","159","Standard query 0x0000 ANY Hans Gruber._companion-link._tcp.local, ""QM"" question SRV 0 0 53591 Hans-Gruber.local OPT"
"61","10.214334","192.168.1.3","224.0.0.251","MDNS","159","Standard query 0x0000 ANY Hans Gruber._companion-link._tcp.local, ""QM"" question SRV 0 0 53591 Hans-Gruber.local OPT"
"62","10.467903","192.168.1.3","224.0.0.251","MDNS","404","Standard query response 0x0000 TXT, cache flush PTR Hans Gruber._companion-link._tcp.local TXT SRV, cache flush 0 0 53591 Hans-Gruber.local A, cache flush 192.168.1.3 NSEC, cache flush Hans Gruber._companion-link._tcp.local NSEC, cache flush Hans-Gruber.local OPT"
"63","10.502977","192.168.1.3","172.217.3.174","UDP","75","65371  >  443 Len=33"
"64","10.524958","172.217.3.174","192.168.1.3","UDP","68","443  >  65371 Len=26"
"65","10.549717","192.168.1.3","54.149.94.178","TLSv1.2","122","Application Data"
"66","10.557590","192.168.1.3","172.217.3.174","UDP","458","65371  >  443 Len=416"
"67","10.576620","54.149.94.178","192.168.1.3","TLSv1.2","122","Application Data"
"68","10.576684","192.168.1.3","54.149.94.178","TCP","66","50908  >  443 [ACK] Seq=113 Ack=113 Win=2047 Len=0 TSval=1877945673 TSecr=1314676819"
"69","10.578430","172.217.3.174","192.168.1.3","UDP","68","443  >  65371 Len=26"
"70","10.648749","172.217.3.174","192.168.1.3","UDP","156","443  >  65371 Len=114"
"71","10.648756","172.217.3.174","192.168.1.3","UDP","314","443  >  65371 Len=272"
"72","10.652210","192.168.1.3","172.217.3.174","UDP","75","65371  >  443 Len=33"
"73","10.715404","192.168.1.3","224.0.0.251","MDNS","578","Standard query 0x0000 PTR _airport._tcp.local, ""QM"" question PTR _rdlink._tcp.local, ""QM"" question PTR _uscan._tcp.local, ""QM"" question PTR _ippusb._tcp.local, ""QM"" question PTR _uscans._tcp.local, ""QM"" question PTR _ipp._tcp.local, ""QM"" question PTR _ipps._tcp.local, ""QM"" question PTR _scanner._tcp.local, ""QM"" question PTR _printer._tcp.local, ""QM"" question PTR _pdl-datastream._tcp.local, ""QM"" question PTR _ptp._tcp.local, ""QM"" question PTR _googlecast._tcp.local, ""QM"" question PTR _homekit._tcp.local, ""QM"" question PTR _companion-link._tcp.local, ""QM"" question TXT Google-Home-Mini-d32bc91b75e125ead80a59ba121b2e34._googlecast._tcp.local, ""QM"" question PTR _apple-mobdev._tcp.local, ""QM"" question PTR 94dc0821._sub._apple-mobdev2._tcp.local, ""QM"" question PTR _apple-pairable._tcp.local, ""QM"" question PTR _afpovertcp._tcp.local, ""QM"" question PTR _smb._tcp.local, ""QM"" question PTR _rfb._tcp.local, ""QM"" question PTR _adisk._tcp.local, ""QM"" question PTR Google-Home-Mini-d32bc91b75e125ead80a59ba121b2e34._googlecast._tcp.local PTR Massage Chair._companion-link._tcp.local PTR BRoom._companion-link._tcp.local PTR Hans Gruber._companion-link._tcp.local OPT"
"74","10.715474","192.168.1.3","224.0.0.251","MDNS","146","Standard query response 0x0000 PTR _companion-link._tcp.local OPT"
"75","10.779562","40.97.161.50","192.168.1.3","TLSv1.2","98","Application Data"
"76","10.779568","40.97.119.178","192.168.1.3","TLSv1.2","98","Application Data"
"77","10.779685","192.168.1.3","40.97.161.50","TCP","54","54975  >  443 [ACK] Seq=1 Ack=45 Win=4095 Len=0"
"78","10.779685","192.168.1.3","40.97.119.178","TCP","54","53915  >  443 [ACK] Seq=1 Ack=45 Win=4095 Len=0"
"79","11.060416","192.168.1.11","224.0.0.251","MDNS","183","Standard query response 0x0000 SRV, cache flush 0 0 8009 d32bc91b-75e1-25ea-d80a-59ba121b2e34.local"
"80","11.472217","192.168.1.3","224.0.0.251","MDNS","404","Standard query response 0x0000 TXT, cache flush PTR Hans Gruber._companion-link._tcp.local TXT SRV, cache flush 0 0 53591 Hans-Gruber.local A, cache flush 192.168.1.3 NSEC, cache flush Hans Gruber._companion-link._tcp.local NSEC, cache flush Hans-Gruber.local OPT"
"81","12.092173","192.168.1.3","172.217.3.165","TCP","54","53062  >  443 [ACK] Seq=1 Ack=1 Win=2048 Len=0"
"82","12.116905","172.217.3.165","192.168.1.3","TCP","66","[TCP ACKed unseen segment] 443  >  53062 [ACK] Seq=1 Ack=2 Win=1050 Len=0 TSval=26200383 TSecr=1877811944"
"83","12.287494","SamsungE_a3:ec:d0","Broadcast","ARP","60","Who has 192.168.1.1? Tell 192.168.1.21"
"84","12.502530","192.168.1.3","172.217.3.174","UDP","1392","65371  >  443 Len=1350"
"85","12.502556","192.168.1.3","172.217.3.174","UDP","532","65371  >  443 Len=490"
"86","12.534963","172.217.3.174","192.168.1.3","UDP","68","443  >  65371 Len=26"
"87","12.540738","172.217.3.174","192.168.1.3","UDP","699","443  >  65371 Len=657"
"88","12.544220","192.168.1.3","172.217.3.174","UDP","75","65371  >  443 Len=33"
"89","12.702109","172.217.3.174","192.168.1.3","UDP","78","443  >  65371 Len=36"
"90","12.705813","192.168.1.3","172.217.3.174","UDP","75","65371  >  443 Len=33"
"91","12.718042","192.168.1.3","224.0.0.251","MDNS","441","Standard query response 0x0000 TXT, cache flush PTR _companion-link._tcp.local PTR Hans Gruber._companion-link._tcp.local TXT SRV, cache flush 0 0 53591 Hans-Gruber.local A, cache flush 192.168.1.3 NSEC, cache flush Hans Gruber._companion-link._tcp.local NSEC, cache flush Hans-Gruber.local OPT"
"92","12.949362","Apple_7e:1e:d4","Broadcast","ARP","42","Who has 192.168.1.9? Tell 192.168.1.3"
"93","12.981211","192.168.1.3","192.168.1.11","TCP","176","53628  >  8009 [PSH, ACK] Seq=221 Ack=221 Win=2048 Len=110 TSval=1877948073 TSecr=5244228 [TCP segment of a reassembled PDU]"
"94","12.986235","192.168.1.11","192.168.1.3","TCP","176","8009  >  53628 [PSH, ACK] Seq=221 Ack=331 Win=660 Len=110 TSval=5244729 TSecr=1877948073 [TCP segment of a reassembled PDU]"
"95","12.986314","192.168.1.3","192.168.1.11","TCP","66","53628  >  8009 [ACK] Seq=331 Ack=331 Win=2046 Len=0 TSval=1877948078 TSecr=5244729"
"96","13.075615","d2:a7:72:cb:a8:a6","Apple_7e:1e:d4","ARP","42","192.168.1.9 is at d2:a7:72:cb:a8:a6"
"97","13.076725","192.168.1.9","192.168.1.9","TCP","54","135  >  135 [SYN] Seq=0 Win=8192 Len=0"
"98","13.077380","192.168.1.9","192.168.1.9","TCP","54","[TCP Out-Of-Order] 135  >  135 [SYN] Seq=0 Win=8192 Len=0"
"99","13.077958","192.168.1.9","192.168.1.9","TCP","54","[TCP Out-Of-Order] 135  >  135 [SYN] Seq=0 Win=8192 Len=0"
"100","13.078529","192.168.1.9","192.168.1.9","TCP","54","[TCP Out-Of-Order] 135  >  135 [SYN] Seq=0 Win=8192 Len=0"
"101","13.079087","192.168.1.9","192.168.1.9","TCP","54","[TCP Out-Of-Order] 135  >  135 [SYN] Seq=0 Win=8192 Len=0"
"102","13.079543","192.168.1.9","192.168.1.9","TCP","54","[TCP Out-Of-Order] 135  >  135 [SYN] Seq=0 Win=8192 Len=0"
"103","13.080004","192.168.1.9","192.168.1.9","TCP","54","[TCP Retransmission] 135  >  135 [SYN] Seq=0 Win=8192 Len=0"
"104","13.080461","192.168.1.9","192.168.1.9","TCP","54","[TCP Retransmission] 135  >  135 [SYN] Seq=0 Win=8192 Len=0"
"105","13.080916","192.168.1.9","192.168.1.9","TCP","54","[TCP Retransmission] 135  >  135 [SYN] Seq=0 Win=8192 Len=0"
"106","13.081370","192.168.1.9","192.168.1.9","TCP","54","[TCP Retransmission] 135  >  135 [SYN] Seq=0 Win=8192 Len=0"
"107","13.081816","192.168.1.9","192.168.1.9","TCP","54","[TCP Retransmission] 135  >  135 [SYN] Seq=0 Win=8192 Len=0"
"108","13.082277","192.168.1.9","192.168.1.9","TCP","54","[TCP Retransmission] 135  >  135 [SYN] Seq=0 Win=8192 Len=0"
"109","13.082720","192.168.1.9","192.168.1.9","TCP","54","[TCP Retransmission] 135  >  135 [SYN] Seq=0 Win=8192 Len=0"
"110","13.083185","192.168.1.9","192.168.1.9","TCP","54","[TCP Retransmission] 135  >  135 [SYN] Seq=0 Win=8192 Len=0"
"111","13.083652","192.168.1.9","192.168.1.9","TCP","54","[TCP Retransmission] 135  >  135 [SYN] Seq=0 Win=8192 Len=0"
"112","13.084085","192.168.1.9","192.168.1.9","TCP","54","[TCP Retransmission] 135  >  135 [SYN] Seq=0 Win=8192 Len=0"
"113","13.084613","192.168.1.9","192.168.1.9","TCP","54","[TCP Retransmission] 135  >  135 [SYN] Seq=0 Win=8192 Len=0"
"114","13.085040","192.168.1.9","192.168.1.9","TCP","54","[TCP Retransmission] 135  >  135 [SYN] Seq=0 Win=8192 Len=0"
"115","13.085439","192.168.1.9","192.168.1.9","TCP","54","[TCP Retransmission] 135  >  135 [SYN] Seq=0 Win=8192 Len=0"
"116","13.085878","192.168.1.9","192.168.1.9","TCP","54","[TCP Retransmission] 135  >  135 [SYN] Seq=0 Win=8192 Len=0"
"117","13.086298","192.168.1.9","192.168.1.9","TCP","54","[TCP Retransmission] 135  >  135 [SYN] Seq=0 Win=8192 Len=0"
"118","13.086717","192.168.1.9","192.168.1.9","TCP","54","[TCP Retransmission] 135  >  135 [SYN] Seq=0 Win=8192 Len=0"
"119","13.087128","192.168.1.9","192.168.1.9","TCP","54","[TCP Retransmission] 135  >  135 [SYN] Seq=0 Win=8192 Len=0"
"120","13.087547","192.168.1.9","192.168.1.9","TCP","54","[TCP Retransmission] 135  >  135 [SYN] Seq=0 Win=8192 Len=0"
"121","13.087967","192.168.1.9","192.168.1.9","TCP","54","[TCP Retransmission] 135  >  135 [SYN] Seq=0 Win=8192 Len=0"
"122","13.088386","192.168.1.9","192.168.1.9","TCP","54","[TCP Retransmission] 135  >  135 [SYN] Seq=0 Win=8192 Len=0"
"123","13.088805","192.168.1.9","192.168.1.9","TCP","54","[TCP Retransmission] 135  >  135 [SYN] Seq=0 Win=8192 Len=0"
"124","13.089214","192.168.1.9","192.168.1.9","TCP","54","[TCP Retransmission] 135  >  135 [SYN] Seq=0 Win=8192 Len=0"
"125","13.089633","192.168.1.9","192.168.1.9","TCP","54","[TCP Retransmission] 135  >  135 [SYN] Seq=0 Win=8192 Len=0"
"126","13.090054","192.168.1.9","192.168.1.9","TCP","54","[TCP Retransmission] 135  >  135 [SYN] Seq=0 Win=8192 Len=0"
"127","13.090534","192.168.1.9","192.168.1.9","TCP","54","[TCP Retransmission] 135  >  135 [SYN] Seq=0 Win=8192 Len=0"
"128","13.090955","192.168.1.9","192.168.1.9","TCP","54","[TCP Retransmission] 135  >  135 [SYN] Seq=0 Win=8192 Len=0"
"129","13.091378","192.168.1.9","192.168.1.9","TCP","54","[TCP Retransmission] 135  >  135 [SYN] Seq=0 Win=8192 Len=0"
"130","13.091816","192.168.1.9","192.168.1.9","TCP","54","[TCP Retransmission] 135  >  135 [SYN] Seq=0 Win=8192 Len=0"
"131","13.092234","192.168.1.9","192.168.1.9","TCP","54","[TCP Retransmission] 135  >  135 [SYN] Seq=0 Win=8192 Len=0"
"132","13.092644","192.168.1.9","192.168.1.9","TCP","54","[TCP Retransmission] 135  >  135 [SYN] Seq=0 Win=8192 Len=0"
"133","13.093019","192.168.1.9","192.168.1.9","TCP","54","[TCP Retransmission] 135  >  135 [SYN] Seq=0 Win=8192 Len=0"
"134","13.093456","192.168.1.9","192.168.1.9","TCP","54","[TCP Retransmission] 135  >  135 [SYN] Seq=0 Win=8192 Len=0"
"135","13.093875","192.168.1.9","192.168.1.9","TCP","54","[TCP Retransmission] 135  >  135 [SYN] Seq=0 Win=8192 Len=0"
"136","13.094274","192.168.1.9","192.168.1.9","TCP","54","[TCP Retransmission] 135  >  135 [SYN] Seq=0 Win=8192 Len=0"
"137","13.094659","192.168.1.9","192.168.1.9","TCP","54","[TCP Retransmission] 135  >  135 [SYN] Seq=0 Win=8192 Len=0"
"138","13.095055","192.168.1.9","192.168.1.9","TCP","54","[TCP Retransmission] 135  >  135 [SYN] Seq=0 Win=8192 Len=0"
"139","13.095569","192.168.1.9","192.168.1.9","TCP","54","[TCP Retransmission] 135  >  135 [SYN] Seq=0 Win=8192 Len=0"
"140","13.095970","192.168.1.9","192.168.1.9","TCP","54","[TCP Retransmission] 135  >  135 [SYN] Seq=0 Win=8192 Len=0"
"141","13.096365","192.168.1.9","192.168.1.9","TCP","54","[TCP Retransmission] 135  >  135 [SYN] Seq=0 Win=8192 Len=0"
"142","13.096762","192.168.1.9","192.168.1.9","TCP","54","[TCP Retransmission] 135  >  135 [SYN] Seq=0 Win=8192 Len=0"
"143","13.097135","192.168.1.9","192.168.1.9","TCP","54","[TCP Retransmission] 135  >  135 [SYN] Seq=0 Win=8192 Len=0"
"144","13.097518","192.168.1.9","192.168.1.9","TCP","54","[TCP Retransmission] 135  >  135 [SYN] Seq=0 Win=8192 Len=0"
"145","13.097894","192.168.1.9","192.168.1.9","TCP","54","[TCP Retransmission] 135  >  135 [SYN] Seq=0 Win=8192 Len=0"
"146","13.098273","192.168.1.9","192.168.1.9","TCP","54","[TCP Retransmission] 135  >  135 [SYN] Seq=0 Win=8192 Len=0"
"147","13.098661","192.168.1.9","192.168.1.9","TCP","54","[TCP Retransmission] 135  >  135 [SYN] Seq=0 Win=8192 Len=0"
"148","13.099037","192.168.1.9","192.168.1.9","TCP","54","[TCP Retransmission] 135  >  135 [SYN] Seq=0 Win=8192 Len=0"
"149","13.099375","192.168.1.9","192.168.1.9","TCP","54","[TCP Retransmission] 135  >  135 [SYN] Seq=0 Win=8192 Len=0"
"150","13.099762","192.168.1.9","192.168.1.9","TCP","54","[TCP Retransmission] 135  >  135 [SYN] Seq=0 Win=8192 Len=0"
"151","13.100129","192.168.1.9","192.168.1.9","TCP","54","[TCP Retransmission] 135  >  135 [SYN] Seq=0 Win=8192 Len=0"
"152","13.100473","192.168.1.9","192.168.1.9","TCP","54","[TCP Retransmission] 135  >  135 [SYN] Seq=0 Win=8192 Len=0"
"153","13.100945","192.168.1.9","192.168.1.9","TCP","54","[TCP Retransmission] 135  >  135 [SYN] Seq=0 Win=8192 Len=0"
"154","13.101348","192.168.1.9","192.168.1.9","TCP","54","[TCP Retransmission] 135  >  135 [SYN] Seq=0 Win=8192 Len=0"
"155","13.101744","192.168.1.9","192.168.1.9","TCP","54","[TCP Retransmission] 135  >  135 [SYN] Seq=0 Win=8192 Len=0"
"156","13.102117","192.168.1.9","192.168.1.9","TCP","54","[TCP Retransmission] 135  >  135 [SYN] Seq=0 Win=8192 Len=0"
"157","13.102490","192.168.1.9","192.168.1.9","TCP","54","[TCP Retransmission] 135  >  135 [SYN] Seq=0 Win=8192 Len=0"
"158","13.102863","192.168.1.9","192.168.1.9","TCP","54","[TCP Retransmission] 135  >  135 [SYN] Seq=0 Win=8192 Len=0"
"159","13.103243","192.168.1.9","192.168.1.9","TCP","54","[TCP Retransmission] 135  >  135 [SYN] Seq=0 Win=8192 Len=0"
"160","13.103584","192.168.1.9","192.168.1.9","TCP","54","[TCP Retransmission] 135  >  135 [SYN] Seq=0 Win=8192 Len=0"
"161","13.103983","192.168.1.9","192.168.1.9","TCP","54","[TCP Retransmission] 135  >  135 [SYN] Seq=0 Win=8192 Len=0"
"162","13.104353","192.168.1.9","192.168.1.9","TCP","54","[TCP Retransmission] 135  >  135 [SYN] Seq=0 Win=8192 Len=0"
"163","13.104717","192.168.1.9","192.168.1.9","TCP","54","[TCP Retransmission] 135  >  135 [SYN] Seq=0 Win=8192 Len=0"
"164","13.105091","192.168.1.9","192.168.1.9","TCP","54","[TCP Retransmission] 135  >  135 [SYN] Seq=0 Win=8192 Len=0"
"165","13.105454","192.168.1.9","192.168.1.9","TCP","54","[TCP Retransmission] 135  >  135 [SYN] Seq=0 Win=8192 Len=0"
"166","13.105836","192.168.1.9","192.168.1.9","TCP","54","[TCP Retransmission] 135  >  135 [SYN] Seq=0 Win=8192 Len=0"
"167","13.106309","192.168.1.9","192.168.1.9","TCP","54","[TCP Retransmission] 135  >  135 [SYN] Seq=0 Win=8192 Len=0"
"168","13.106659","192.168.1.9","192.168.1.9","TCP","54","[TCP Retransmission] 135  >  135 [SYN] Seq=0 Win=8192 Len=0"
"169","13.107023","192.168.1.9","192.168.1.9","TCP","54","[TCP Retransmission] 135  >  135 [SYN] Seq=0 Win=8192 Len=0"
"170","13.107373","192.168.1.9","192.168.1.9","TCP","54","[TCP Retransmission] 135  >  135 [SYN] Seq=0 Win=8192 Len=0"
"171","13.107720","192.168.1.9","192.168.1.9","TCP","54","[TCP Retransmission] 135  >  135 [SYN] Seq=0 Win=8192 Len=0"
"172","13.108042","192.168.1.9","192.168.1.9","TCP","54","[TCP Retransmission] 135  >  135 [SYN] Seq=0 Win=8192 Len=0"
"173","13.108413","192.168.1.9","192.168.1.9","TCP","54","[TCP Retransmission] 135  >  135 [SYN] Seq=0 Win=8192 Len=0"
"174","13.108770","192.168.1.9","192.168.1.9","TCP","54","[TCP Retransmission] 135  >  135 [SYN] Seq=0 Win=8192 Len=0"
"175","13.109108","192.168.1.9","192.168.1.9","TCP","54","[TCP Retransmission] 135  >  135 [SYN] Seq=0 Win=8192 Len=0"
"176","13.109445","192.168.1.9","192.168.1.9","TCP","54","[TCP Retransmission] 135  >  135 [SYN] Seq=0 Win=8192 Len=0"
"177","13.109782","192.168.1.9","192.168.1.9","TCP","54","[TCP Retransmission] 135  >  135 [SYN] Seq=0 Win=8192 Len=0"
"178","13.110119","192.168.1.9","192.168.1.9","TCP","54","[TCP Retransmission] 135  >  135 [SYN] Seq=0 Win=8192 Len=0"
"179","13.110434","192.168.1.9","192.168.1.9","TCP","54","[TCP Retransmission] 135  >  135 [SYN] Seq=0 Win=8192 Len=0"
"180","13.110790","192.168.1.9","192.168.1.9","TCP","54","[TCP Retransmission] 135  >  135 [SYN] Seq=0 Win=8192 Len=0"
"181","13.111137","192.168.1.9","192.168.1.9","TCP","54","[TCP Retransmission] 135  >  135 [SYN] Seq=0 Win=8192 Len=0"
"182","13.111484","192.168.1.9","192.168.1.9","TCP","54","[TCP Retransmission] 135  >  135 [SYN] Seq=0 Win=8192 Len=0"
"183","13.111810","192.168.1.9","192.168.1.9","TCP","54","[TCP Retransmission] 135  >  135 [SYN] Seq=0 Win=8192 Len=0"
"184","13.112141","192.168.1.9","192.168.1.9","TCP","54","[TCP Retransmission] 135  >  135 [SYN] Seq=0 Win=8192 Len=0"
"185","13.112476","192.168.1.9","192.168.1.9","TCP","54","[TCP Retransmission] 135  >  135 [SYN] Seq=0 Win=8192 Len=0"
"186","13.112809","192.168.1.9","192.168.1.9","TCP","54","[TCP Retransmission] 135  >  135 [SYN] Seq=0 Win=8192 Len=0"
"187","13.113140","192.168.1.9","192.168.1.9","TCP","54","[TCP Retransmission] 135  >  135 [SYN] Seq=0 Win=8192 Len=0"
"188","13.113473","192.168.1.9","192.168.1.9","TCP","54","[TCP Retransmission] 135  >  135 [SYN] Seq=0 Win=8192 Len=0"
"189","13.113789","192.168.1.9","192.168.1.9","TCP","54","[TCP Retransmission] 135  >  135 [SYN] Seq=0 Win=8192 Len=0"
"190","13.114123","192.168.1.9","192.168.1.9","TCP","54","[TCP Retransmission] 135  >  135 [SYN] Seq=0 Win=8192 Len=0"
"191","13.114458","192.168.1.9","192.168.1.9","TCP","54","[TCP Retransmission] 135  >  135 [SYN] Seq=0 Win=8192 Len=0"
"192","13.114806","192.168.1.9","192.168.1.9","TCP","54","[TCP Retransmission] 135  >  135 [SYN] Seq=0 Win=8192 Len=0"
"193","13.115133","192.168.1.9","192.168.1.9","TCP","54","[TCP Retransmission] 135  >  135 [SYN] Seq=0 Win=8192 Len=0"
"194","13.115458","192.168.1.9","192.168.1.9","TCP","54","[TCP Retransmission] 135  >  135 [SYN] Seq=0 Win=8192 Len=0"
"195","13.115872","192.168.1.9","192.168.1.9","TCP","54","[TCP Retransmission] 135  >  135 [SYN] Seq=0 Win=8192 Len=0"
"196","13.116319","192.168.1.9","192.168.1.9","TCP","54","[TCP Retransmission] 135  >  135 [SYN] Seq=0 Win=8192 Len=0"
"197","13.116644","192.168.1.9","192.168.1.9","TCP","54","[TCP Retransmission] 135  >  135 [SYN] Seq=0 Win=8192 Len=0"
"198","13.116971","192.168.1.9","192.168.1.9","TCP","54","[TCP Retransmission] 135  >  135 [SYN] Seq=0 Win=8192 Len=0"
"199","13.117288","192.168.1.9","192.168.1.9","TCP","54","[TCP Retransmission] 135  >  135 [SYN] Seq=0 Win=8192 Len=0"
"200","13.117610","192.168.1.9","192.168.1.9","TCP","54","[TCP Retransmission] 135  >  135 [SYN] Seq=0 Win=8192 Len=0"
"201","13.117936","192.168.1.9","192.168.1.9","TCP","54","[TCP Retransmission] 135  >  135 [SYN] Seq=0 Win=8192 Len=0"
"202","13.118262","192.168.1.9","192.168.1.9","TCP","54","[TCP Retransmission] 135  >  135 [SYN] Seq=0 Win=8192 Len=0"
"203","13.118581","192.168.1.9","192.168.1.9","TCP","54","[TCP Retransmission] 135  >  135 [SYN] Seq=0 Win=8192 Len=0"
"204","13.118906","192.168.1.9","192.168.1.9","TCP","54","[TCP Retransmission] 135  >  135 [SYN] Seq=0 Win=8192 Len=0"
"205","13.119210","192.168.1.9","192.168.1.9","TCP","54","[TCP Retransmission] 135  >  135 [SYN] Seq=0 Win=8192 Len=0"
"206","13.119545","192.168.1.9","192.168.1.9","TCP","54","[TCP Retransmission] 135  >  135 [SYN] Seq=0 Win=8192 Len=0"
"207","13.119863","192.168.1.9","192.168.1.9","TCP","54","[TCP Retransmission] 135  >  135 [SYN] Seq=0 Win=8192 Len=0"
"208","13.120186","192.168.1.9","192.168.1.9","TCP","54","[TCP Retransmission] 135  >  135 [SYN] Seq=0 Win=8192 Len=0"
"209","13.120483","192.168.1.9","192.168.1.9","TCP","54","[TCP Retransmission] 135  >  135 [SYN] Seq=0 Win=8192 Len=0"
"210","13.120806","192.168.1.9","192.168.1.9","TCP","54","[TCP Retransmission] 135  >  135 [SYN] Seq=0 Win=8192 Len=0"
"211","13.121129","192.168.1.9","192.168.1.9","TCP","54","[TCP Retransmission] 135  >  135 [SYN] Seq=0 Win=8192 Len=0"
"212","13.121456","192.168.1.9","192.168.1.9","TCP","54","[TCP Retransmission] 135  >  135 [SYN] Seq=0 Win=8192 Len=0"
"213","13.121757","192.168.1.9","192.168.1.9","TCP","54","[TCP Retransmission] 135  >  135 [SYN] Seq=0 Win=8192 Len=0"
"214","13.122096","192.168.1.9","192.168.1.9","TCP","54","[TCP Retransmission] 135  >  135 [SYN] Seq=0 Win=8192 Len=0"
"215","13.122421","192.168.1.9","192.168.1.9","TCP","54","[TCP Retransmission] 135  >  135 [SYN] Seq=0 Win=8192 Len=0"
"216","13.122738","192.168.1.9","192.168.1.9","TCP","54","[TCP Retransmission] 135  >  135 [SYN] Seq=0 Win=8192 Len=0"
"217","13.123055","192.168.1.9","192.168.1.9","TCP","54","[TCP Retransmission] 135  >  135 [SYN] Seq=0 Win=8192 Len=0"
"218","13.123370","192.168.1.9","192.168.1.9","TCP","54","[TCP Retransmission] 135  >  135 [SYN] Seq=0 Win=8192 Len=0"
"219","13.123692","192.168.1.9","192.168.1.9","TCP","54","[TCP Retransmission] 135  >  135 [SYN] Seq=0 Win=8192 Len=0"
"220","13.124013","192.168.1.9","192.168.1.9","TCP","54","[TCP Retransmission] 135  >  135 [SYN] Seq=0 Win=8192 Len=0"
"221","13.124326","192.168.1.9","192.168.1.9","TCP","54","[TCP Retransmission] 135  >  135 [SYN] Seq=0 Win=8192 Len=0"
"222","13.124647","192.168.1.9","192.168.1.9","TCP","54","[TCP Retransmission] 135  >  135 [SYN] Seq=0 Win=8192 Len=0"
"223","13.124971","192.168.1.9","192.168.1.9","TCP","54","[TCP Retransmission] 135  >  135 [SYN] Seq=0 Win=8192 Len=0"
"224","13.125287","192.168.1.9","192.168.1.9","TCP","54","[TCP Retransmission] 135  >  135 [SYN] Seq=0 Win=8192 Len=0"
"225","13.125727","192.168.1.9","192.168.1.9","TCP","54","[TCP Retransmission] 135  >  135 [SYN] Seq=0 Win=8192 Len=0"
"226","13.126049","192.168.1.9","192.168.1.9","TCP","54","[TCP Retransmission] 135  >  135 [SYN] Seq=0 Win=8192 Len=0"
"227","13.126367","192.168.1.9","192.168.1.9","TCP","54","[TCP Retransmission] 135  >  135 [SYN] Seq=0 Win=8192 Len=0"
"228","13.126684","192.168.1.9","192.168.1.9","TCP","54","[TCP Retransmission] 135  >  135 [SYN] Seq=0 Win=8192 Len=0"
"229","13.127002","192.168.1.9","192.168.1.9","TCP","54","[TCP Retransmission] 135  >  135 [SYN] Seq=0 Win=8192 Len=0"
"230","13.127321","192.168.1.9","192.168.1.9","TCP","54","[TCP Retransmission] 135  >  135 [SYN] Seq=0 Win=8192 Len=0"
"231","13.127634","192.168.1.9","192.168.1.9","TCP","54","[TCP Retransmission] 135  >  135 [SYN] Seq=0 Win=8192 Len=0"
"232","13.127952","192.168.1.9","192.168.1.9","TCP","54","[TCP Retransmission] 135  >  135 [SYN] Seq=0 Win=8192 Len=0"
"233","13.128271","192.168.1.9","192.168.1.9","TCP","54","[TCP Retransmission] 135  >  135 [SYN] Seq=0 Win=8192 Len=0"
"234","13.128585","192.168.1.9","192.168.1.9","TCP","54","[TCP Retransmission] 135  >  135 [SYN] Seq=0 Win=8192 Len=0"
"235","13.128902","192.168.1.9","192.168.1.9","TCP","54","[TCP Retransmission] 135  >  135 [SYN] Seq=0 Win=8192 Len=0"
"236","13.129208","192.168.1.9","192.168.1.9","TCP","54","[TCP Retransmission] 135  >  135 [SYN] Seq=0 Win=8192 Len=0"
"237","13.129550","192.168.1.9","192.168.1.9","TCP","54","[TCP Retransmission] 135  >  135 [SYN] Seq=0 Win=8192 Len=0"
"238","13.129937","192.168.1.9","192.168.1.9","TCP","54","[TCP Retransmission] 135  >  135 [SYN] Seq=0 Win=8192 Len=0"
"239","13.130280","192.168.1.9","192.168.1.9","TCP","54","[TCP Retransmission] 135  >  135 [SYN] Seq=0 Win=8192 Len=0"
"240","13.130670","192.168.1.9","192.168.1.9","TCP","54","[TCP Retransmission] 135  >  135 [SYN] Seq=0 Win=8192 Len=0"
"241","13.131000","192.168.1.9","192.168.1.9","TCP","54","[TCP Retransmission] 135  >  135 [SYN] Seq=0 Win=8192 Len=0"
"242","13.131324","192.168.1.9","192.168.1.9","TCP","54","[TCP Retransmission] 135  >  135 [SYN] Seq=0 Win=8192 Len=0"
"243","13.131650","192.168.1.9","192.168.1.9","TCP","54","[TCP Retransmission] 135  >  135 [SYN] Seq=0 Win=8192 Len=0"
"244","13.131965","192.168.1.9","192.168.1.9","TCP","54","[TCP Retransmission] 135  >  135 [SYN] Seq=0 Win=8192 Len=0"
"245","13.132289","192.168.1.9","192.168.1.9","TCP","54","[TCP Retransmission] 135  >  135 [SYN] Seq=0 Win=8192 Len=0"
"246","13.132600","192.168.1.9","192.168.1.9","TCP","54","[TCP Retransmission] 135  >  135 [SYN] Seq=0 Win=8192 Len=0"
"247","13.132918","192.168.1.9","192.168.1.9","TCP","54","[TCP Retransmission] 135  >  135 [SYN] Seq=0 Win=8192 Len=0"
"248","13.133232","192.168.1.9","192.168.1.9","TCP","54","[TCP Retransmission] 135  >  135 [SYN] Seq=0 Win=8192 Len=0"
"249","13.133545","192.168.1.9","192.168.1.9","TCP","54","[TCP Retransmission] 135  >  135 [SYN] Seq=0 Win=8192 Len=0"
"250","13.133863","192.168.1.9","192.168.1.9","TCP","54","[TCP Retransmission] 135  >  135 [SYN] Seq=0 Win=8192 Len=0"
"251","13.134174","192.168.1.9","192.168.1.9","TCP","54","[TCP Retransmission] 135  >  135 [SYN] Seq=0 Win=8192 Len=0"
"252","13.134489","192.168.1.9","192.168.1.9","TCP","54","[TCP Retransmission] 135  >  135 [SYN] Seq=0 Win=8192 Len=0"
"253","13.134802","192.168.1.9","192.168.1.9","TCP","54","[TCP Retransmission] 135  >  135 [SYN] Seq=0 Win=8192 Len=0"
"254","13.135244","192.168.1.9","192.168.1.9","TCP","54","[TCP Retransmission] 135  >  135 [SYN] Seq=0 Win=8192 Len=0"
"255","13.135562","192.168.1.9","192.168.1.9","TCP","54","[TCP Retransmission] 135  >  135 [SYN] Seq=0 Win=8192 Len=0"
"256","13.135881","192.168.1.9","192.168.1.9","TCP","54","[TCP Retransmission] 135  >  135 [SYN] Seq=0 Win=8192 Len=0"
"257","13.136194","192.168.1.9","192.168.1.9","TCP","54","[TCP Retransmission] 135  >  135 [SYN] Seq=0 Win=8192 Len=0"
"258","13.136508","192.168.1.9","192.168.1.9","TCP","54","[TCP Retransmission] 135  >  135 [SYN] Seq=0 Win=8192 Len=0"
"259","13.136823","192.168.1.9","192.168.1.9","TCP","54","[TCP Retransmission] 135  >  135 [SYN] Seq=0 Win=8192 Len=0"
"260","13.137141","192.168.1.9","192.168.1.9","TCP","54","[TCP Retransmission] 135  >  135 [SYN] Seq=0 Win=8192 Len=0"
"261","13.137459","192.168.1.9","192.168.1.9","TCP","54","[TCP Retransmission] 135  >  135 [SYN] Seq=0 Win=8192 Len=0"
"262","13.137771","192.168.1.9","192.168.1.9","TCP","54","[TCP Retransmission] 135  >  135 [SYN] Seq=0 Win=8192 Len=0"
"263","13.138088","192.168.1.9","192.168.1.9","TCP","54","[TCP Retransmission] 135  >  135 [SYN] Seq=0 Win=8192 Len=0"
"264","13.138400","192.168.1.9","192.168.1.9","TCP","54","[TCP Retransmission] 135  >  135 [SYN] Seq=0 Win=8192 Len=0"
"265","13.138711","192.168.1.9","192.168.1.9","TCP","54","[TCP Retransmission] 135  >  135 [SYN] Seq=0 Win=8192 Len=0"
"266","13.139053","192.168.1.9","192.168.1.9","TCP","54","[TCP Retransmission] 135  >  135 [SYN] Seq=0 Win=8192 Len=0"
"267","13.139372","192.168.1.9","192.168.1.9","TCP","54","[TCP Retransmission] 135  >  135 [SYN] Seq=0 Win=8192 Len=0"
"268","13.139686","192.168.1.9","192.168.1.9","TCP","54","[TCP Retransmission] 135  >  135 [SYN] Seq=0 Win=8192 Len=0"
"269","13.140003","192.168.1.9","192.168.1.9","TCP","54","[TCP Retransmission] 135  >  135 [SYN] Seq=0 Win=8192 Len=0"
"270","13.140325","192.168.1.9","192.168.1.9","TCP","54","[TCP Retransmission] 135  >  135 [SYN] Seq=0 Win=8192 Len=0"
"271","13.140642","192.168.1.9","192.168.1.9","TCP","54","[TCP Retransmission] 135  >  135 [SYN] Seq=0 Win=8192 Len=0"
"272","13.140952","192.168.1.9","192.168.1.9","TCP","54","[TCP Retransmission] 135  >  135 [SYN] Seq=0 Win=8192 Len=0"
"273","13.141264","192.168.1.9","192.168.1.9","TCP","54","[TCP Retransmission] 135  >  135 [SYN] Seq=0 Win=8192 Len=0"
"274","13.141579","192.168.1.9","192.168.1.9","TCP","54","[TCP Retransmission] 135  >  135 [SYN] Seq=0 Win=8192 Len=0"
"275","13.141895","192.168.1.9","192.168.1.9","TCP","54","[TCP Retransmission] 135  >  135 [SYN] Seq=0 Win=8192 Len=0"
"276","13.142208","192.168.1.9","192.168.1.9","TCP","54","[TCP Retransmission] 135  >  135 [SYN] Seq=0 Win=8192 Len=0"
"277","13.142524","192.168.1.9","192.168.1.9","TCP","54","[TCP Retransmission] 135  >  135 [SYN] Seq=0 Win=8192 Len=0"
"278","13.142837","192.168.1.9","192.168.1.9","TCP","54","[TCP Retransmission] 135  >  135 [SYN] Seq=0 Win=8192 Len=0"
"279","13.143152","192.168.1.9","192.168.1.9","TCP","54","[TCP Retransmission] 135  >  135 [SYN] Seq=0 Win=8192 Len=0"
"280","13.143468","192.168.1.9","192.168.1.9","TCP","54","[TCP Retransmission] 135  >  135 [SYN] Seq=0 Win=8192 Len=0"
"281","13.143788","192.168.1.9","192.168.1.9","TCP","54","[TCP Retransmission] 135  >  135 [SYN] Seq=0 Win=8192 Len=0"
"282","13.144088","192.168.1.9","192.168.1.9","TCP","54","[TCP Retransmission] 135  >  135 [SYN] Seq=0 Win=8192 Len=0"
"283","13.144518","192.168.1.9","192.168.1.9","TCP","54","[TCP Retransmission] 135  >  135 [SYN] Seq=0 Win=8192 Len=0"
"284","13.144860","192.168.1.9","192.168.1.9","TCP","54","[TCP Retransmission] 135  >  135 [SYN] Seq=0 Win=8192 Len=0"
"285","13.145177","192.168.1.9","192.168.1.9","TCP","54","[TCP Retransmission] 135  >  135 [SYN] Seq=0 Win=8192 Len=0"
"286","13.145481","192.168.1.9","192.168.1.9","TCP","54","[TCP Retransmission] 135  >  135 [SYN] Seq=0 Win=8192 Len=0"
"287","13.145805","192.168.1.9","192.168.1.9","TCP","54","[TCP Retransmission] 135  >  135 [SYN] Seq=0 Win=8192 Len=0"
"288","13.146122","192.168.1.9","192.168.1.9","TCP","54","[TCP Retransmission] 135  >  135 [SYN] Seq=0 Win=8192 Len=0"
"289","13.146455","192.168.1.9","192.168.1.9","TCP","54","[TCP Retransmission] 135  >  135 [SYN] Seq=0 Win=8192 Len=0"
"290","13.146766","192.168.1.9","192.168.1.9","TCP","54","[TCP Retransmission] 135  >  135 [SYN] Seq=0 Win=8192 Len=0"
"291","13.147082","192.168.1.9","192.168.1.9","TCP","54","[TCP Retransmission] 135  >  135 [SYN] Seq=0 Win=8192 Len=0"
"292","13.147400","192.168.1.9","192.168.1.9","TCP","54","[TCP Retransmission] 135  >  135 [SYN] Seq=0 Win=8192 Len=0"
"293","13.147714","192.168.1.9","192.168.1.9","TCP","54","[TCP Retransmission] 135  >  135 [SYN] Seq=0 Win=8192 Len=0"
"294","13.148028","192.168.1.9","192.168.1.9","TCP","54","[TCP Retransmission] 135  >  135 [SYN] Seq=0 Win=8192 Len=0"
"295","13.148333","192.168.1.9","192.168.1.9","TCP","54","[TCP Retransmission] 135  >  135 [SYN] Seq=0 Win=8192 Len=0"
"296","13.148654","192.168.1.9","192.168.1.9","TCP","54","[TCP Retransmission] 135  >  135 [SYN] Seq=0 Win=8192 Len=0"
"297","13.148966","192.168.1.9","192.168.1.9","TCP","54","[TCP Retransmission] 135  >  135 [SYN] Seq=0 Win=8192 Len=0"
"298","13.149282","192.168.1.9","192.168.1.9","TCP","54","[TCP Retransmission] 135  >  135 [SYN] Seq=0 Win=8192 Len=0"
"299","13.149584","192.168.1.9","192.168.1.9","TCP","54","[TCP Retransmission] 135  >  135 [SYN] Seq=0 Win=8192 Len=0"
"300","13.149912","192.168.1.9","192.168.1.9","TCP","54","[TCP Retransmission] 135  >  135 [SYN] Seq=0 Win=8192 Len=0"
"301","13.150228","192.168.1.9","192.168.1.9","TCP","54","[TCP Retransmission] 135  >  135 [SYN] Seq=0 Win=8192 Len=0"
"302","13.150539","192.168.1.9","192.168.1.9","TCP","54","[TCP Retransmission] 135  >  135 [SYN] Seq=0 Win=8192 Len=0"
"303","13.150837","192.168.1.9","192.168.1.9","TCP","54","[TCP Retransmission] 135  >  135 [SYN] Seq=0 Win=8192 Len=0"
"304","13.151168","192.168.1.9","192.168.1.9","TCP","54","[TCP Retransmission] 135  >  135 [SYN] Seq=0 Win=8192 Len=0"
"305","13.151478","192.168.1.9","192.168.1.9","TCP","54","[TCP Retransmission] 135  >  135 [SYN] Seq=0 Win=8192 Len=0"
"306","13.151794","192.168.1.9","192.168.1.9","TCP","54","[TCP Retransmission] 135  >  135 [SYN] Seq=0 Win=8192 Len=0"
"307","13.152109","192.168.1.9","192.168.1.9","TCP","54","[TCP Retransmission] 135  >  135 [SYN] Seq=0 Win=8192 Len=0"
"308","13.152428","192.168.1.9","192.168.1.9","TCP","54","[TCP Retransmission] 135  >  135 [SYN] Seq=0 Win=8192 Len=0"
"309","13.152741","192.168.1.9","192.168.1.9","TCP","54","[TCP Retransmission] 135  >  135 [SYN] Seq=0 Win=8192 Len=0"
"310","13.153053","192.168.1.9","192.168.1.9","TCP","54","[TCP Retransmission] 135  >  135 [SYN] Seq=0 Win=8192 Len=0"
"311","13.153377","192.168.1.9","192.168.1.9","TCP","54","[TCP Retransmission] 135  >  135 [SYN] Seq=0 Win=8192 Len=0"
"312","13.153814","192.168.1.9","192.168.1.9","TCP","54","[TCP Retransmission] 135  >  135 [SYN] Seq=0 Win=8192 Len=0"
"313","13.154129","192.168.1.9","192.168.1.9","TCP","54","[TCP Retransmission] 135  >  135 [SYN] Seq=0 Win=8192 Len=0"
"314","13.154445","192.168.1.9","192.168.1.9","TCP","54","[TCP Retransmission] 135  >  135 [SYN] Seq=0 Win=8192 Len=0"
"315","13.154760","192.168.1.9","192.168.1.9","TCP","54","[TCP Retransmission] 135  >  135 [SYN] Seq=0 Win=8192 Len=0"
"316","13.155074","192.168.1.9","192.168.1.9","TCP","54","[TCP Retransmission] 135  >  135 [SYN] Seq=0 Win=8192 Len=0"
"317","13.155389","192.168.1.9","192.168.1.9","TCP","54","[TCP Retransmission] 135  >  135 [SYN] Seq=0 Win=8192 Len=0"
